{
  "as_of_time": "2026-08-10T00:00:00+08:00",
  "authority": {
    "acceptance_owner": "consumer_owner",
    "business_action_owner": "consumer_domain",
    "causal_grade_owner": "ECAE",
    "producer_self_acceptance_forbidden": true
  },
  "completion_gate": {
    "all_controlled_pilot_consumer_acceptances_signed": true,
    "all_production_consumer_acceptances_signed": false,
    "all_production_differences_dispositioned": false,
    "all_production_dual_runs_completed": false,
    "all_production_rollback_drills_passed": false,
    "l4_production_acceptance_complete": false,
    "local_contract_implementation_complete": true,
    "wp11_controlled_pilot_complete": true
  },
  "consumers": [
    {
      "acceptance": {
        "accepted_uses": [
          "causal_investment_support"
        ],
        "conditions": [
          "controlled_pilot_non_production_only",
          "business_owner_decision_required",
          "production_and_high_stakes_use_requires_L4_evidence",
          "external_write_forbidden"
        ],
        "consumer_owner_role": "D01_consumer_owner",
        "production_signed_record_ref": null,
        "production_status": "not_executed",
        "scope": "controlled_pilot_non_production",
        "signed_record_ref": "experiment-causal-assessment/evaluations/consumer-controlled-pilot-acceptance/D01.json",
        "status": "conditionally_accepted"
      },
      "contract_version": "1.1.0",
      "domain_id": "D01",
      "domain_specific_mappings": [
        {
          "classification": "conditional",
          "destination": "CIDM.investment_evidence.causal_grade",
          "rule": "supports but never determines investment posture",
          "source": "causal_evidence_grade"
        }
      ],
      "dual_run": {
        "difference_evidence_ref": "experiment-causal-assessment/evaluations/consumer-migration-local-verification.json",
        "difference_status": "fixture_dispositioned",
        "local_fixture_ref": "category-investment-decision/integrations/experiment-causal-assessment/acceptance.json",
        "local_fixture_status": "fixture_verified",
        "production_evidence_ref": null,
        "production_status": "not_executed"
      },
      "external_write": false,
      "forbidden_writeback": [
        "category investment posture",
        "capital budget",
        "entry add reduce exit",
        "portfolio allocation"
      ],
      "invalidation_policy": {
        "on_contract_change": "reaccept_and_recompute",
        "on_expiry": "mark_stale_request_recompute",
        "on_trigger": "mark_stale_request_recompute",
        "silent_continued_consumption_forbidden": true
      },
      "legacy_assets": {
        "absence_reason": null,
        "paths": [
          "category-investment-decision/scripts/evaluate_experiment.py"
        ]
      },
      "legacy_automatic_ceiling": "CE0",
      "legacy_mapping_rule": "funnel gate decisions are business heuristics rather than causal identification",
      "legacy_reassessment_ceiling": "CE2",
      "mapping_profile": "causal_handoff_v1_full",
      "producer_inputs": [
        "decision question",
        "minimum important effect",
        "experiment cost and risk"
      ],
      "prohibited_legacy_mappings": [
        "CONTINUE_to_CE4",
        "Go_to_incremental"
      ],
      "retained_sovereignty": [
        "category investment posture",
        "capital budget",
        "entry add reduce exit"
      ],
      "rollback": {
        "blocked_actions": [
          "causal investment claim",
          "automatic capital action"
        ],
        "causal_wording_allowed": false,
        "local_drill_status": "fixture_verified",
        "mode": "legacy_descriptive_read_only",
        "production_drill_evidence_ref": null,
        "recompute_required": true,
        "unknown_incremental_value_policy": "unknown_never_zero_fill"
      },
      "runtime_prefix": "CIDM",
      "skill": "category-investment-decision",
      "use_requirements": [
        {
          "fallback_use": "descriptive_only",
          "minimum_grade": "CE4",
          "required_handoff_action": "consider_within_consumer_decision_contract",
          "required_payload_fields": [],
          "requires_independent_review": false,
          "use": "causal_investment_support"
        },
        {
          "fallback_use": "descriptive_only",
          "minimum_grade": "CE5",
          "required_handoff_action": "consider_within_consumer_decision_contract",
          "required_payload_fields": [],
          "requires_independent_review": true,
          "use": "high_stakes_capital_support"
        }
      ]
    },
    {
      "acceptance": {
        "accepted_uses": [
          "alternative_explanation_support",
          "causal_competitive_attribution_support"
        ],
        "conditions": [
          "controlled_pilot_non_production_only",
          "business_owner_decision_required",
          "production_and_high_stakes_use_requires_L4_evidence",
          "external_write_forbidden"
        ],
        "consumer_owner_role": "D02_consumer_owner",
        "production_signed_record_ref": null,
        "production_status": "not_executed",
        "scope": "controlled_pilot_non_production",
        "signed_record_ref": "experiment-causal-assessment/evaluations/consumer-controlled-pilot-acceptance/D02.json",
        "status": "conditionally_accepted"
      },
      "contract_version": "1.1.0",
      "domain_id": "D02",
      "domain_specific_mappings": [
        {
          "classification": "conditional",
          "destination": "CIM.competitive_attribution.causal_claim_ceiling",
          "rule": "CIM may narrow the claim but cannot call temporal adjacency causal",
          "source": "claim_ceiling"
        }
      ],
      "dual_run": {
        "difference_evidence_ref": "experiment-causal-assessment/evaluations/consumer-migration-local-verification.json",
        "difference_status": "fixture_dispositioned",
        "local_fixture_ref": "competitive-intelligence-monitoring/integrations/experiment-causal-assessment/acceptance.json",
        "local_fixture_status": "fixture_verified",
        "production_evidence_ref": null,
        "production_status": "not_executed"
      },
      "external_write": false,
      "forbidden_writeback": [
        "competitor identity",
        "competitive event confirmation",
        "competitive attribution",
        "monitoring action"
      ],
      "invalidation_policy": {
        "on_contract_change": "reaccept_and_recompute",
        "on_expiry": "mark_stale_request_recompute",
        "on_trigger": "mark_stale_request_recompute",
        "silent_continued_consumption_forbidden": true
      },
      "legacy_assets": {
        "absence_reason": null,
        "paths": [
          "competitive-intelligence-monitoring/references/anomaly-detection-and-attribution.md"
        ]
      },
      "legacy_automatic_ceiling": "CE0",
      "legacy_mapping_rule": "observational triangulation may support attribution confidence but not experimental identification",
      "legacy_reassessment_ceiling": "CE3",
      "mapping_profile": "causal_handoff_v1_full",
      "producer_inputs": [
        "shock evidence",
        "alternative explanations",
        "placebo and negative-control candidates"
      ],
      "prohibited_legacy_mappings": [
        "three_signals_to_CE4",
        "attributed_to_incremental"
      ],
      "retained_sovereignty": [
        "competitor identity",
        "competitive event confirmation",
        "competitive attribution"
      ],
      "rollback": {
        "blocked_actions": [
          "causal competitor claim",
          "automatic competitor response"
        ],
        "causal_wording_allowed": false,
        "local_drill_status": "fixture_verified",
        "mode": "legacy_descriptive_read_only",
        "production_drill_evidence_ref": null,
        "recompute_required": true,
        "unknown_incremental_value_policy": "unknown_never_zero_fill"
      },
      "runtime_prefix": "CIM",
      "skill": "competitive-intelligence-monitoring",
      "use_requirements": [
        {
          "fallback_use": "descriptive_only",
          "minimum_grade": "CE3",
          "required_handoff_action": "consider_within_consumer_decision_contract",
          "required_payload_fields": [],
          "requires_independent_review": false,
          "use": "alternative_explanation_support"
        },
        {
          "fallback_use": "descriptive_only",
          "minimum_grade": "CE4",
          "required_handoff_action": "consider_within_consumer_decision_contract",
          "required_payload_fields": [],
          "requires_independent_review": false,
          "use": "causal_competitive_attribution_support"
        }
      ]
    },
    {
      "acceptance": {
        "accepted_uses": [
          "causal_product_validation"
        ],
        "conditions": [
          "controlled_pilot_non_production_only",
          "business_owner_decision_required",
          "production_and_high_stakes_use_requires_L4_evidence",
          "external_write_forbidden"
        ],
        "consumer_owner_role": "D03_consumer_owner",
        "production_signed_record_ref": null,
        "production_status": "not_executed",
        "scope": "controlled_pilot_non_production",
        "signed_record_ref": "experiment-causal-assessment/evaluations/consumer-controlled-pilot-acceptance/D03.json",
        "status": "conditionally_accepted"
      },
      "contract_version": "1.1.0",
      "domain_id": "D03",
      "domain_specific_mappings": [
        {
          "classification": "direct",
          "destination": "PIPM.validation.causal_result_ref",
          "rule": "replaces the temporary causal block only after signed acceptance",
          "source": "causal_result_ref"
        }
      ],
      "dual_run": {